{
  "schema": "agentlens.run.v1",
  "run_id": "run_20260101_000000_aaaaaa",
  "workspace_id": "ws_0000000000000001",
  "started_at": "2026-01-01T00:00:00Z",
  "agent": {
    "name": "generic",
    "mode": "cli"
  },
  "workspace": {
    "root_label": "./workspace",
    "root_hash": "sha256:21a3230e03772a58aff1b3709a9e232850916337e1fba95c434076b6668c6e08",
    "id_basis": "path"
  },
  "recording": {
    "mode": "minimal",
    "adapter": "generic"
  }
}
